{"assurance":"independently_verified","attempt_id":"1","compensation":"not_evaluated","effect_id":"effect-1","evidence_ref":"sha256:220bee17b974600875597867de0204577a82104ad35ed20890788c019cc76bf3","issuer":"sqlite-local","key_sha256":"66e7c82b49bb291dd09c8e020448311c4a7bb96aeb5c5db769f66812b13a50b5","mechanism":"sqlite_unique_transaction","observed_state":"committed","operation":"create","precondition_sha256":"2e1cfa82b035c26cbbbdae632cea070514eb8b773f616aaeaf668e2f0be8f10d","replay_class":"external_idempotent","reported_state":"unknown","request_sha256":"5d9ed3e553e331782b9949a16cb6da2f85f69e52f6ed39aad436d82736e6e7ac","result_sha256":"5f0460517928c8448d1dc75ff565b36ff097af9f8970d3855d3c106d1a33594e","run_id":"run-1790478309693-7553","schema":"dispatch.effect-assurance/v1alpha1","scope_sha256":"a12761cad0670a9138957d7dd3652efb12c1d09e5791af38f60b47cd23e06fb1","step_id":"action","target_sha256":"02be10a21673e4c2adf623f30914fbf0055185c6c622b9238b9819395540ca8a","transaction_sha256":"ca2bf73d2fe837d09e1c8b0fd7e29f2d7a3ef41008da7a4310ffd243a049b68f","valid_from":1790478304,"valid_until":1790478321}