{"assurance":"independently_verified","attempt_id":"1","compensation":"not_evaluated","effect_id":"effect-1","evidence_ref":"sha256:eccc4661b3731587877bdfae886d411c1a144193687cb8e0fdf470b06045f9ae","issuer":"git-local","key_sha256":"66e7c82b49bb291dd09c8e020448311c4a7bb96aeb5c5db769f66812b13a50b5","mechanism":"git_ref_cas_transaction","observed_state":"committed","operation":"update","precondition_sha256":"6e1c9d73ac1ea74ae915688a8167094f99383e5b611d916a8a63f06a9846eebe","replay_class":"external_idempotent","reported_state":"unknown","request_sha256":"6bd274d6cf09226a0314c634f5976cf06d392a524bcc148bd6752b708809f6ac","result_sha256":"7771663fc241374b75a96294f34fb932b1a0673b93679f33d2ee30d5fcd178a9","run_id":"run-1790478345559-9964","schema":"dispatch.effect-assurance/v1alpha1","scope_sha256":"890ec381063838cabbb1fa9517a7fbc69cdf1d0811648fb299ea82010f5f8a66","step_id":"action","target_sha256":"e47405bd41679ff6c6f13dfdff426fd006c9c1fda60cfe437bce6064863ca33e","transaction_sha256":"1d4d8b453803b3941f002ee34f42c9775d1b3647ea018ee279829712aa9f9485","valid_from":1790478340,"valid_until":1790478357}