{"assurance":"independently_verified","attempt_id":"1","compensation":"not_evaluated","effect_id":"effect-1","evidence_ref":"sha256:cd426dd0595c2c9cfa793b0b057e0a7a5bcf3056a74b75f1dad43a8aee92295d","issuer":"git-local","key_sha256":"66e7c82b49bb291dd09c8e020448311c4a7bb96aeb5c5db769f66812b13a50b5","mechanism":"git_ref_cas_transaction","observed_state":"committed","operation":"update","precondition_sha256":"6e1c9d73ac1ea74ae915688a8167094f99383e5b611d916a8a63f06a9846eebe","replay_class":"external_idempotent","reported_state":"unknown","request_sha256":"6bd274d6cf09226a0314c634f5976cf06d392a524bcc148bd6752b708809f6ac","result_sha256":"e998a2e833f789e21edf2cfddfee3d2bf4c4ef892d194678d0bcacad6d82c027","run_id":"run-1790478335041-5981","schema":"dispatch.effect-assurance/v1alpha1","scope_sha256":"bf08015d0c4cf6e0a856f608be2d4b1287d4f73cdf552e7e2e0770b90c654abd","step_id":"action","target_sha256":"e47405bd41679ff6c6f13dfdff426fd006c9c1fda60cfe437bce6064863ca33e","transaction_sha256":"bb56e7bcd552ac90378c26e61033aee23584e605877ad65e0e7315157ee3e9ca","valid_from":1790478329,"valid_until":1790480134}