{"assurance":"independently_verified","attempt_id":"1","compensation":"not_evaluated","effect_id":"effect-1","evidence_ref":"sha256:8423c8e5ba8d202f8c29083e6b9a9ffe4efa684bdf59bfb8acf5f09f3f6a2c22","issuer":"sqlite-local","key_sha256":"66e7c82b49bb291dd09c8e020448311c4a7bb96aeb5c5db769f66812b13a50b5","mechanism":"sqlite_unique_transaction","observed_state":"committed","operation":"create","precondition_sha256":"2e1cfa82b035c26cbbbdae632cea070514eb8b773f616aaeaf668e2f0be8f10d","replay_class":"external_idempotent","reported_state":"unknown","request_sha256":"5d9ed3e553e331782b9949a16cb6da2f85f69e52f6ed39aad436d82736e6e7ac","result_sha256":"8670603004b55b3c1008bcd939fb832efa386f8510caa89553c37bdf786d4977","run_id":"run-1790478301851-9765","schema":"dispatch.effect-assurance/v1alpha1","scope_sha256":"f8094c07283fb6c5bce453e019317568152b0923f09ddd629eeeec5eaeb05e40","step_id":"action","target_sha256":"02be10a21673e4c2adf623f30914fbf0055185c6c622b9238b9819395540ca8a","transaction_sha256":"e7742f25657d13cd1b21cc7ebc31f3c638874d42f7f0493aefbe1e79654f5002","valid_from":1790478296,"valid_until":1790480101}