{"assurance":"independently_verified","attempt_id":"1","compensation":"not_evaluated","effect_id":"effect-1","evidence_ref":"sha256:eb3cb93aaa1c7d1f2a829892694167b766b0192a27e97512ec12ef5d1094d84c","issuer":"git-local","key_sha256":"66e7c82b49bb291dd09c8e020448311c4a7bb96aeb5c5db769f66812b13a50b5","mechanism":"git_ref_cas_transaction","observed_state":"committed","operation":"update","precondition_sha256":"6e1c9d73ac1ea74ae915688a8167094f99383e5b611d916a8a63f06a9846eebe","replay_class":"external_non_idempotent","reported_state":"unknown","request_sha256":"6bd274d6cf09226a0314c634f5976cf06d392a524bcc148bd6752b708809f6ac","result_sha256":"1ac24b761c47981d96e0207e61d44665531bfcf9833ed96ab99faf8240f83fa2","run_id":"run-1790478357798-8858","schema":"dispatch.effect-assurance/v1alpha1","scope_sha256":"ee9deefc0a33ce678eced82242dd24ee3cedc490c7bdb82bdd0b000008877be2","step_id":"action","target_sha256":"e47405bd41679ff6c6f13dfdff426fd006c9c1fda60cfe437bce6064863ca33e","transaction_sha256":"493840ac78aca9b873fdf2c9b7056c1d4537d6bda82ee276a074bfe2b35e5fea","valid_from":1790478352,"valid_until":1790480157}