{
  "assurance": "independently_verified",
  "attempt_id": "1",
  "compensation": "not_evaluated",
  "effect_id": "effect-1",
  "evidence_ref": "sha256:d141878afb88b38b4cd1f0f821096c303ec5c46ac325d65596bebd6a5aff989a",
  "issuer": "sqlite-local",
  "key_sha256": "66e7c82b49bb291dd09c8e020448311c4a7bb96aeb5c5db769f66812b13a50b5",
  "mechanism": "sqlite_unique_transaction",
  "observed_state": "not_started",
  "operation": "create",
  "precondition_sha256": "2e1cfa82b035c26cbbbdae632cea070514eb8b773f616aaeaf668e2f0be8f10d",
  "replay_class": "external_idempotent",
  "reported_state": "unknown",
  "request_sha256": "5d9ed3e553e331782b9949a16cb6da2f85f69e52f6ed39aad436d82736e6e7ac",
  "result_sha256": "c9cce13fab0d7f5c7a8293c35a7dc8446f7f96bd739ba2934291ce68637cbf35",
  "run_id": "run-1790477876040-2021",
  "schema": "dispatch.effect-assurance/v1alpha1",
  "scope_sha256": "2075b5809cf8a6e8751029baea1b746ca67b3b06c82001cdabe3b9e5bd0bcfa1",
  "step_id": "action",
  "target_sha256": "02be10a21673e4c2adf623f30914fbf0055185c6c622b9238b9819395540ca8a",
  "transaction_sha256": "7ffbd5c4cd1a310a37ed19203145b99510770b289dcb85fdcc353ce134ba7364",
  "valid_from": 1790477870,
  "valid_until": 1790479675
}
