{"assurance":"independently_verified","attempt_id":"1","compensation":"not_evaluated","effect_id":"effect-1","evidence_ref":"sha256:bf15951ca70cc39b0ce9d7db35c60f9fdd679346a1dc89b485116b7c4f7e7d57","issuer":"git-local","key_sha256":"66e7c82b49bb291dd09c8e020448311c4a7bb96aeb5c5db769f66812b13a50b5","mechanism":"git_ref_cas_transaction","observed_state":"not_started","operation":"update","precondition_sha256":"6e1c9d73ac1ea74ae915688a8167094f99383e5b611d916a8a63f06a9846eebe","replay_class":"external_idempotent","reported_state":"unknown","request_sha256":"6bd274d6cf09226a0314c634f5976cf06d392a524bcc148bd6752b708809f6ac","result_sha256":"c0469d7fe4673425449a830225c16de5667b35d3478a8a64ab79d4bd6b2c5330","run_id":"run-1790478324443-5972","schema":"dispatch.effect-assurance/v1alpha1","scope_sha256":"7ab5b66fc2467dc773bc5c043164c8d87c43e85b5cbb6c04ece2d7621fd5e6fa","step_id":"action","target_sha256":"e47405bd41679ff6c6f13dfdff426fd006c9c1fda60cfe437bce6064863ca33e","transaction_sha256":"c222a292acd49adda28e1fdfb0dcf0bb9fdaee9bc75e543b20b9dcf4e892851f","valid_from":1790478319,"valid_until":1790480124}