{"assurance":"independently_verified","attempt_id":"1","compensation":"not_evaluated","effect_id":"effect-1","evidence_ref":"sha256:fcfbd447a1fae1ce0f13889132800b3ea18be13c12ddabeead93e4c8c8fb6517","issuer":"sqlite-local","key_sha256":"66e7c82b49bb291dd09c8e020448311c4a7bb96aeb5c5db769f66812b13a50b5","mechanism":"sqlite_unique_transaction","observed_state":"committed","operation":"create","precondition_sha256":"2e1cfa82b035c26cbbbdae632cea070514eb8b773f616aaeaf668e2f0be8f10d","replay_class":"external_non_idempotent","reported_state":"unknown","request_sha256":"5d9ed3e553e331782b9949a16cb6da2f85f69e52f6ed39aad436d82736e6e7ac","result_sha256":"a3611128898493f51e90f755c8611217d83a1fc85fa5842d89e22120d457c4a0","run_id":"run-1790478321775-8573","schema":"dispatch.effect-assurance/v1alpha1","scope_sha256":"efe9453028fcd7291dc0a75f67cd4dffa3468ceb9c5a6b66e61e6052ffa8d1b7","step_id":"action","target_sha256":"02be10a21673e4c2adf623f30914fbf0055185c6c622b9238b9819395540ca8a","transaction_sha256":"1285d399ce6ebcf4e52f4265f1cbc789338b867f91911c446a0ed4115bc8afad","valid_from":1790478316,"valid_until":1790480121}