{"assurance":"independently_verified","attempt_id":"1","compensation":"not_evaluated","effect_id":"effect-1","evidence_ref":"sha256:0686a92ec9c24b90c5048ffdba0e5bf51c1b7caa611156f99b6ce82f7960ad19","issuer":"sqlite-local","key_sha256":"66e7c82b49bb291dd09c8e020448311c4a7bb96aeb5c5db769f66812b13a50b5","mechanism":"sqlite_unique_transaction","observed_state":"not_started","operation":"create","precondition_sha256":"2e1cfa82b035c26cbbbdae632cea070514eb8b773f616aaeaf668e2f0be8f10d","replay_class":"external_idempotent","reported_state":"unknown","request_sha256":"5d9ed3e553e331782b9949a16cb6da2f85f69e52f6ed39aad436d82736e6e7ac","result_sha256":"0ebfa8c630849f9fdfe85c6ec3c26c19a1958d595427745f51680c4602f3c06b","run_id":"run-1790478293522-7399","schema":"dispatch.effect-assurance/v1alpha1","scope_sha256":"7578a4f31eccb97890d6f11f9ad24fe426cae802f38c7e7363b9a38e50f073c1","step_id":"action","target_sha256":"02be10a21673e4c2adf623f30914fbf0055185c6c622b9238b9819395540ca8a","transaction_sha256":"969b4c69197aa1d487a679f5eb67268e960bd716b34ccc001c46304e590143be","valid_from":1790478288,"valid_until":1790480093}